type,context,query,answer
翻译,初荐王安石，及同辅政，知上方向之，阴为子孙计，凡更张庶事，一切听顺，而外若不与之者。,外,外表上
注释,旋以太傅致仕，元丰元年卒，年八十。,致仕,交还官职，退休
填空,"臣所以莅之以威严，节之以宪纲，欲渐加训导，使知分限。",节,约束
填空,"而恶直丑正，实繁有徒，故讼臣无恩，称孤之美。",徒,徒众、同伙
选择,"出为平东将军、怀荒镇大将。",出,调出京城任职
选择,"世祖疑谓不实，切责之，以公归第。",切,严厉
翻译,"既至，怀柔羌戎，莫不归附。追讨崖等，皆获之。征还，拜散骑常侍。",怀柔,安抚、笼络
注释,"诸高车莫弗讼俟严急，待下无恩，还请前镇将郎孤。",莫弗,部落首领的称号
填空,遂得精兵万余，置官吏，立排甲，具器仗。谕曰：“我祖宗艰难创业……”,谕,告知，晓谕
填空,其后嗣君耽乐无厌，不恤国政，盗贼蜂起，天下土崩。,耽,沉迷
选择,惟尔众亦有轸我国家，忧我社稷，思共救君父，济生民于难者乎？,轸,B. 痛惜
选择,行万余里无所得，牛马多死，勒兵而还。,勒,D. 率领
翻译,使我天祚皇帝蒙尘于外，日夜痛心疾首。,蒙尘,指帝王流亡在外，蒙受屈辱
翻译,残我黎庶，屠翦我州邑。,屠翦,屠杀并摧毁，形容破坏之烈
注释,辽以翰林为林牙，故称大石林牙。,林牙,辽代对翰林的称呼，为官名
填空,"述号叫呼天，幸而获免，咸以为精诚所致也。高祖闻而嘉之，及临豫州，讽中正以述为主簿，甚被知器。",嘉,夸奖，赞许
填空,"述语子综曰：“主上矜邵夙诚，将加曲恕，吾所启谬会，故特见酬纳耳。”",矜,同情，怜惜
选择,"高祖闻而嘉之，及临豫州，讽中正以述为主簿，甚被知器。",讽,婉言暗示
选择,"若此疏迹宣布，则为侵夺主恩，不可之大者也。",宣布,传布
翻译,"除吴郡太守，以疾不之官。病差，补吴兴太守。在郡清省，为吏民所怀。",除,授予官职
翻译,"除吴郡太守，以疾不之官。病差，补吴兴太守。在郡清省，为吏民所怀。",差,病情好转
翻译,"除吴郡太守，以疾不之官。病差，补吴兴太守。在郡清省，为吏民所怀。",清省,清廉简约
注释,"雍州刺史张邵以黩货下廷尉……义康外镇，将行……",外镇,被贬镇抚地方
填空,"两生素贱其人，力拒之。",贱,轻视
填空,"今日非速君饮，欲少吐胸中不平气耳。",速,邀请
选择,"不能忍君苦也！",苦,嫌弃
选择,"会丞相与王有隙，格其事不下。",格,搁置
翻译,"徒欲驰骋文墨，儿抚一世豪杰，此何可哉！",儿抚,把……当作孩子一样轻视（轻视）
翻译,"古者学在养气，今人一服儒衣，反奄奄欲绝，徒欲驰骋文墨，儿抚一世豪杰，此何可哉！",养气,培养刚正之气（或精神气概）
填空,两生素贱其人,素,向来
填空,今日非速君饮,速,邀请
选择,不能忍君苦也,苦,嫌弃
选择,格其事不下,格,搁置
翻译,今人一服儒衣，反奄奄欲绝，徒欲驰骋文墨，儿抚一世豪杰，此何可哉！,奄奄,气息微弱的样子，形容精神萎靡不振
翻译,今人一服儒衣，反奄奄欲绝，徒欲驰骋文墨，儿抚一世豪杰，此何可哉！,儿抚,把……当作孩子一样对待，意为轻视、蔑视
